<?xml version="1.0" encoding="UTF-8"?>
<FlussoFattureTrasportoGas 
    xmlns:xsi="https://www.w3.org/2001/XMLSchema" 
    xsi:noNamespaceSchemaLocation="FlussoFattureGas.xsd">
    
  <TestataFlusso>
    <TipoFlusso></TipoFlusso>
    <DataCreazione></DataCreazione>
    <Versione></Versione>
    <NumeroSequenza></NumeroSequenza>
  </TestataFlusso>

  <Mittente>
    <RagioneSociale></RagioneSociale>
    <PartitaIVA></PartitaIVA>
    <PartitaIVAGruppo></PartitaIVAGruppo>
    <CodiceFiscale></CodiceFiscale>
    <Indirizzo>
      <Intestazione></Intestazione>
      <Indirizzo></Indirizzo>
      <CAP></CAP>
      <Localita></Localita>
      <Provincia></Provincia>
      <Nazione></Nazione>
    </Indirizzo>
    <Email></Email>
    <Telefono></Telefono>
    <Pagamento>
      <CondizioniPagamento></CondizioniPagamento>
      <ModalitaPagamento></ModalitaPagamento>
      <IBAN></IBAN>
    </Pagamento>
  </Mittente>

  <Destinatario>
    <RagioneSociale></RagioneSociale>
    <PartitaIVA></PartitaIVA>
    <PartitaIVAGruppo></PartitaIVAGruppo>
    <CodiceFiscale></CodiceFiscale>
    <IndirizzoFatturazione>
      <Intestazione></Intestazione>
      <Indirizzo></Indirizzo>
      <CAP></CAP>
      <Localita></Localita>
      <Provincia></Provincia>
      <Nazione></Nazione>
    </IndirizzoFatturazione>
    <IndirizzoSpedizione>
      <Intestazione></Intestazione>
      <Indirizzo></Indirizzo>
      <CAP></CAP>
      <Localita></Localita>
      <Provincia></Provincia>
      <Nazione></Nazione>
    </IndirizzoSpedizione>
  </Destinatario>

  <Fattura>
    <Numero></Numero>
    <DataEmissione></DataEmissione>
    <DataScadenza></DataScadenza>
    <TotaleImponibile></TotaleImponibile>
    <TotaleIVA></TotaleIVA>
    <Totale></Totale>
    <ImportoBollo></ImportoBollo>
    <Note></Note>

    <VociFattura>
      <VoceFattura>
        <CategoriaVoceFatturata></CategoriaVoceFatturata>
        <CodiceRiferimentoIVA></CodiceRiferimentoIVA>
        <Imponibile></Imponibile>
      </VoceFattura>
    </VociFattura>

    <RiferimentiIVA>
      <RiferimentoIVA>
        <Codice></Codice>
        <Descrizione></Descrizione>
        <Aliquota></Aliquota>
      </RiferimentoIVA>
      <RiferimentoIVA>
        <Codice></Codice>
        <Descrizione></Descrizione>
        <Aliquota></Aliquota>
      </RiferimentoIVA>
    </RiferimentiIVA>
  </Fattura>

  <DettagliPDR>
    <DettaglioPDR>
      <CodicePDR></CodicePDR>
      <REMIPool></REMIPool>
      <CodiceISTAT></CodiceISTAT>
      <Comune></Comune>
      <CoefficienteC></CoefficienteC>
      <Correttore></Correttore>
      <ProgrAnnoSolare></ProgrAnnoSolare>
      <ClasseMisuratore></ClasseMisuratore>
      <TipoPDR></TipoPDR>
      <AmbitoTariffario></AmbitoTariffario>
      <Importi>
        <Importo>
          <DataInizio></DataInizio>
          <DataFine></DataFine>
          <TipoMovimento></TipoMovimento>
          <ComponenteTariffaria></ComponenteTariffaria>
          <RegimeCompensazioneBonus></RegimeCompensazioneBonus>
          <CodiceBonusSII></CodiceBonusSII>
          <Quota></Quota>
          <Scaglione></Scaglione>
          <Quantita></Quantita>
          <Imponibile></Imponibile>
        </Importo>
    </DettaglioPDR>
  </DettagliPDR>

  <ChiusuraFlusso>
    <UltimoElementoSequenza></UltimoElementoSequenza>
  </ChiusuraFlusso>
</FlussoFattureTrasporto>
